{
  "dtype": "float32",
  "endianness": "little",
  "n_stored": 200,
  "entries": [
    {
      "site_id": "TLS-01",
      "drug": "carbamazepine",
      "offset": 0,
      "count": 200
    },
    {
      "site_id": "TLS-01",
      "drug": "atenolol",
      "offset": 200,
      "count": 200
    },
    {
      "site_id": "TLS-01",
      "drug": "losartan",
      "offset": 400,
      "count": 200
    },
    {
      "site_id": "TLS-01",
      "drug": "irbesartan",
      "offset": 600,
      "count": 200
    },
    {
      "site_id": "TLS-01",
      "drug": "paracetamol",
      "offset": 800,
      "count": 200
    },
    {
      "site_id": "TLS-01",
      "drug": "citalopram",
      "offset": 1000,
      "count": 200
    },
    {
      "site_id": "TLS-02",
      "drug": "carbamazepine",
      "offset": 1200,
      "count": 200
    },
    {
      "site_id": "TLS-02",
      "drug": "atenolol",
      "offset": 1400,
      "count": 200
    },
    {
      "site_id": "TLS-02",
      "drug": "losartan",
      "offset": 1600,
      "count": 200
    },
    {
      "site_id": "TLS-02",
      "drug": "irbesartan",
      "offset": 1800,
      "count": 200
    },
    {
      "site_id": "TLS-02",
      "drug": "paracetamol",
      "offset": 2000,
      "count": 200
    },
    {
      "site_id": "TLS-02",
      "drug": "citalopram",
      "offset": 2200,
      "count": 200
    },
    {
      "site_id": "TLS-03",
      "drug": "carbamazepine",
      "offset": 2400,
      "count": 200
    },
    {
      "site_id": "TLS-03",
      "drug": "atenolol",
      "offset": 2600,
      "count": 200
    },
    {
      "site_id": "TLS-03",
      "drug": "losartan",
      "offset": 2800,
      "count": 200
    },
    {
      "site_id": "TLS-03",
      "drug": "irbesartan",
      "offset": 3000,
      "count": 200
    },
    {
      "site_id": "TLS-03",
      "drug": "paracetamol",
      "offset": 3200,
      "count": 200
    },
    {
      "site_id": "TLS-03",
      "drug": "citalopram",
      "offset": 3400,
      "count": 200
    },
    {
      "site_id": "TLS-04",
      "drug": "carbamazepine",
      "offset": 3600,
      "count": 200
    },
    {
      "site_id": "TLS-04",
      "drug": "atenolol",
      "offset": 3800,
      "count": 200
    },
    {
      "site_id": "TLS-04",
      "drug": "losartan",
      "offset": 4000,
      "count": 200
    },
    {
      "site_id": "TLS-04",
      "drug": "irbesartan",
      "offset": 4200,
      "count": 200
    },
    {
      "site_id": "TLS-04",
      "drug": "paracetamol",
      "offset": 4400,
      "count": 200
    },
    {
      "site_id": "TLS-04",
      "drug": "citalopram",
      "offset": 4600,
      "count": 200
    },
    {
      "site_id": "TLS-05",
      "drug": "carbamazepine",
      "offset": 4800,
      "count": 200
    },
    {
      "site_id": "TLS-05",
      "drug": "atenolol",
      "offset": 5000,
      "count": 200
    },
    {
      "site_id": "TLS-05",
      "drug": "losartan",
      "offset": 5200,
      "count": 200
    },
    {
      "site_id": "TLS-05",
      "drug": "irbesartan",
      "offset": 5400,
      "count": 200
    },
    {
      "site_id": "TLS-05",
      "drug": "paracetamol",
      "offset": 5600,
      "count": 200
    },
    {
      "site_id": "TLS-05",
      "drug": "citalopram",
      "offset": 5800,
      "count": 200
    },
    {
      "site_id": "TLS-06",
      "drug": "carbamazepine",
      "offset": 6000,
      "count": 200
    },
    {
      "site_id": "TLS-06",
      "drug": "atenolol",
      "offset": 6200,
      "count": 200
    },
    {
      "site_id": "TLS-06",
      "drug": "losartan",
      "offset": 6400,
      "count": 200
    },
    {
      "site_id": "TLS-06",
      "drug": "irbesartan",
      "offset": 6600,
      "count": 200
    },
    {
      "site_id": "TLS-06",
      "drug": "paracetamol",
      "offset": 6800,
      "count": 200
    },
    {
      "site_id": "TLS-06",
      "drug": "citalopram",
      "offset": 7000,
      "count": 200
    },
    {
      "site_id": "TLS-07",
      "drug": "carbamazepine",
      "offset": 7200,
      "count": 200
    },
    {
      "site_id": "TLS-07",
      "drug": "atenolol",
      "offset": 7400,
      "count": 200
    },
    {
      "site_id": "TLS-07",
      "drug": "losartan",
      "offset": 7600,
      "count": 200
    },
    {
      "site_id": "TLS-07",
      "drug": "irbesartan",
      "offset": 7800,
      "count": 200
    },
    {
      "site_id": "TLS-07",
      "drug": "paracetamol",
      "offset": 8000,
      "count": 200
    },
    {
      "site_id": "TLS-07",
      "drug": "citalopram",
      "offset": 8200,
      "count": 200
    },
    {
      "site_id": "TLS-08",
      "drug": "carbamazepine",
      "offset": 8400,
      "count": 200
    },
    {
      "site_id": "TLS-08",
      "drug": "atenolol",
      "offset": 8600,
      "count": 200
    },
    {
      "site_id": "TLS-08",
      "drug": "losartan",
      "offset": 8800,
      "count": 200
    },
    {
      "site_id": "TLS-08",
      "drug": "irbesartan",
      "offset": 9000,
      "count": 200
    },
    {
      "site_id": "TLS-08",
      "drug": "paracetamol",
      "offset": 9200,
      "count": 200
    },
    {
      "site_id": "TLS-08",
      "drug": "citalopram",
      "offset": 9400,
      "count": 200
    },
    {
      "site_id": "TLS-09",
      "drug": "carbamazepine",
      "offset": 9600,
      "count": 200
    },
    {
      "site_id": "TLS-09",
      "drug": "atenolol",
      "offset": 9800,
      "count": 200
    },
    {
      "site_id": "TLS-09",
      "drug": "losartan",
      "offset": 10000,
      "count": 200
    },
    {
      "site_id": "TLS-09",
      "drug": "irbesartan",
      "offset": 10200,
      "count": 200
    },
    {
      "site_id": "TLS-09",
      "drug": "paracetamol",
      "offset": 10400,
      "count": 200
    },
    {
      "site_id": "TLS-09",
      "drug": "citalopram",
      "offset": 10600,
      "count": 200
    },
    {
      "site_id": "GNT-01",
      "drug": "carbamazepine",
      "offset": 10800,
      "count": 200
    },
    {
      "site_id": "GNT-01",
      "drug": "atenolol",
      "offset": 11000,
      "count": 200
    },
    {
      "site_id": "GNT-01",
      "drug": "losartan",
      "offset": 11200,
      "count": 200
    },
    {
      "site_id": "GNT-01",
      "drug": "irbesartan",
      "offset": 11400,
      "count": 200
    },
    {
      "site_id": "GNT-01",
      "drug": "paracetamol",
      "offset": 11600,
      "count": 200
    },
    {
      "site_id": "GNT-01",
      "drug": "citalopram",
      "offset": 11800,
      "count": 200
    },
    {
      "site_id": "GNT-02",
      "drug": "carbamazepine",
      "offset": 12000,
      "count": 200
    },
    {
      "site_id": "GNT-02",
      "drug": "atenolol",
      "offset": 12200,
      "count": 200
    },
    {
      "site_id": "GNT-02",
      "drug": "losartan",
      "offset": 12400,
      "count": 200
    },
    {
      "site_id": "GNT-02",
      "drug": "irbesartan",
      "offset": 12600,
      "count": 200
    },
    {
      "site_id": "GNT-02",
      "drug": "paracetamol",
      "offset": 12800,
      "count": 200
    },
    {
      "site_id": "GNT-02",
      "drug": "citalopram",
      "offset": 13000,
      "count": 200
    },
    {
      "site_id": "GNT-03",
      "drug": "carbamazepine",
      "offset": 13200,
      "count": 200
    },
    {
      "site_id": "GNT-03",
      "drug": "atenolol",
      "offset": 13400,
      "count": 200
    },
    {
      "site_id": "GNT-03",
      "drug": "losartan",
      "offset": 13600,
      "count": 200
    },
    {
      "site_id": "GNT-03",
      "drug": "irbesartan",
      "offset": 13800,
      "count": 200
    },
    {
      "site_id": "GNT-03",
      "drug": "paracetamol",
      "offset": 14000,
      "count": 200
    },
    {
      "site_id": "GNT-03",
      "drug": "citalopram",
      "offset": 14200,
      "count": 200
    },
    {
      "site_id": "GNT-04",
      "drug": "carbamazepine",
      "offset": 14400,
      "count": 200
    },
    {
      "site_id": "GNT-04",
      "drug": "atenolol",
      "offset": 14600,
      "count": 200
    },
    {
      "site_id": "GNT-04",
      "drug": "losartan",
      "offset": 14800,
      "count": 200
    },
    {
      "site_id": "GNT-04",
      "drug": "irbesartan",
      "offset": 15000,
      "count": 200
    },
    {
      "site_id": "GNT-04",
      "drug": "paracetamol",
      "offset": 15200,
      "count": 200
    },
    {
      "site_id": "GNT-04",
      "drug": "citalopram",
      "offset": 15400,
      "count": 200
    },
    {
      "site_id": "GNT-05",
      "drug": "carbamazepine",
      "offset": 15600,
      "count": 200
    },
    {
      "site_id": "GNT-05",
      "drug": "atenolol",
      "offset": 15800,
      "count": 200
    },
    {
      "site_id": "GNT-05",
      "drug": "losartan",
      "offset": 16000,
      "count": 200
    },
    {
      "site_id": "GNT-05",
      "drug": "irbesartan",
      "offset": 16200,
      "count": 200
    },
    {
      "site_id": "GNT-05",
      "drug": "paracetamol",
      "offset": 16400,
      "count": 200
    },
    {
      "site_id": "GNT-05",
      "drug": "citalopram",
      "offset": 16600,
      "count": 200
    },
    {
      "site_id": "GNT-06",
      "drug": "carbamazepine",
      "offset": 16800,
      "count": 200
    },
    {
      "site_id": "GNT-06",
      "drug": "atenolol",
      "offset": 17000,
      "count": 200
    },
    {
      "site_id": "GNT-06",
      "drug": "losartan",
      "offset": 17200,
      "count": 200
    },
    {
      "site_id": "GNT-06",
      "drug": "irbesartan",
      "offset": 17400,
      "count": 200
    },
    {
      "site_id": "GNT-06",
      "drug": "paracetamol",
      "offset": 17600,
      "count": 200
    },
    {
      "site_id": "GNT-06",
      "drug": "citalopram",
      "offset": 17800,
      "count": 200
    },
    {
      "site_id": "GNT-07",
      "drug": "carbamazepine",